### ISSUE TITLE
unable to view PPPoE tunnel packet

### ISSUE THREAD

**Issue by itsmartsteve** [aol/moloch#536]
Hi there,

i'm not sure this is a bug or design of the system. apparently i cannot view any packet capture inside the PPPoE tunnel. I can use tcpdump -r filename.pcap to view the file and confirmed the packet was captured properly but i unable to view it in the moloch-viewer interface.

sample packet capture as below,
03:51:40.267679 PPPoE  [ses 0x59f7] IP 10.50.0.2.51051 > 103.21.81.23.http: Flags [.], ack 199064, win 258, length 0
03:51:40.275320 PPPoE  [ses 0x440e] IP 10.249.0.6.52407 > edge-star-shv-01-sin6.facebook.com.https: Flags [.], ack 69, win 4093, options [nop,nop,TS val 524449190 ecr 3688653656], length 0
03:51:40.275336 PPPoE  [ses 0x440e] IP 10.249.0.6.52407 > edge-star-shv-01-sin6.facebook.com.https: Flags [.], ack 137, win 4091, options [nop,nop,TS val 524449190 ecr 3688653677], length 0
03:51:40.278380 PPPoE  [ses 0x1c8] IP server-54-240-168-122.sin3.r.cloudfront.net.https > 10.249.0.7.53993: Flags [.], ack 224, win 118, options [nop,nop,TS val 327658430 ecr 5570866], length 0

I'm on ubuntu 14.0.5 with moloch 0.15/ES 2.4

Appreciate anyone can give me a hand on this matter.

thanks,

**Comment by awick** [comment]
do you have a pcap you can share?

**Comment by itsmartsteve** [comment]
Yes. How can i share the file to you? Email?

Thanks

**Comment by awick** [comment]
andywick gmail

**Comment by itsmartsteve** [comment]
ok, sent.

**Comment by itsmartsteve** [comment]
it's working now. 

thank you for making this feature available !
